{
  "$schema": "../schemas/tretnix-task.schema.json",
  "task_version": 1,
  "title": "Controlled Tretnix Development OS task",
  "repository": "Tretnix-knowledge",
  "objective": "Execute an explicitly approved Development OS task using the merged Knowledge baseline.",
  "tags": ["automation", "knowledge", "tooling", "workflow"],
  "task_class": "security_or_data",
  "risk": "medium",
  "writer": "codex",
  "allowed_scope": [
    "approved root governance documents",
    "compiled/",
    "schemas/",
    "scripts/",
    "skills/",
    "templates/",
    "tools/tretnix/"
  ],
  "forbidden": [
    "Tretnix.com changes",
    "stage",
    "commit",
    "push",
    "pull request",
    "merge",
    "deploy",
    "migration",
    "DNS changes",
    "secret mutation"
  ],
  "required_outputs": ["implementation", "tests", "evidence", "full diff review", "remaining gates"],
  "working_tree": "dirty_allowed"
}
